<?xml version="1.0" encoding="UTF-8" ?>
<!DOCTYPE suppliers SYSTEM "../dtd/suppliers.dtd">
<suppliers>
    <description>Some sample supplier data</description>
    <supplier>
        <sid>s1</sid>
        <name>Countup</name>
        <address>12 High Street, Christchurch</address>
        <phone type="work">3451234</phone>
        <email>daveG@countup.co.nz</email>
        <url>countup.co.nz/high</url>
    </supplier>
    <supplier>
        <sid>s2</sid>
        <name>Funky Kumquat</name>
        <address>125 Woodside Lane, Christchurch</address>
        <phone type="mobile">021352176</phone>
        <email>maryC@fkveg.co.nz</email>
    </supplier>
    <supplier>
        <sid>s3</sid>
        <name>Admiral Benjamin's Seafoods</name>
        <address>86 Low Street, Christchurch</address>
        <phone type="mobile">021345666</phone>
        <email>bigben@cfoods.co.nz</email>
        <url>cfoods.co.nz</url>
    </supplier>
    <supplier>
        <sid>s4</sid>
        <name>Dave's Drinks</name>
        <address>Unit 5, Bert's Business Park, Christchurch</address>
        <phone type="work">3515666</phone>
        <email>daved@davesdrinks.co.nz</email>
        <url></url>
    </supplier>
</suppliers>